{
  "$schema": "https://json-schema.org/draft/2020-12/schema",
  "$id": "https://schemas.ardyn.ai/boundary-maps/ardyn.phase-5.27.approval-evaluator-candidate-intake-checkpoint.schema.json",
  "title": "ARDYN Boundary Map: ardyn.phase-5.27.approval-evaluator-candidate-intake-checkpoint",
  "description": "Auto-generated JSON Schema for boundary-map artifact validation. Enforces shape + safety invariants.",
  "type": "object",
  "required": [
    "schema",
    "schemaVersion",
    "phase",
    "artifactKind",
    "metadataGeneratedAt",
    "sourcePhase",
    "intakeSummary",
    "intakeInputShape",
    "intakeResultShape",
    "intakeCases",
    "intakeCheckpointStateBoundary",
    "blockedRuntimeEffect",
    "serveRuntimeBlockedBehavior",
    "forbiddenBehavior",
    "filesAllowedToChange",
    "filesForbiddenToChange",
    "validationCommands"
  ],
  "properties": {
    "schema": {
      "type": "string",
      "const": "ardyn.phase-5.27.approval-evaluator-candidate-intake-checkpoint"
    },
    "schemaVersion": {
      "type": "string"
    },
    "phase": {
      "type": "string"
    },
    "artifactKind": {
      "type": "string"
    },
    "metadataGeneratedAt": {
      "type": "string"
    },
    "sourcePhase": {
      "type": "object"
    },
    "intakeSummary": {
      "type": "object"
    },
    "intakeInputShape": {
      "type": "object"
    },
    "intakeResultShape": {
      "type": "object"
    },
    "intakeCases": {
      "type": "array"
    },
    "intakeCheckpointStateBoundary": {
      "type": "object"
    },
    "blockedRuntimeEffect": {
      "type": "object"
    },
    "serveRuntimeBlockedBehavior": {
      "type": "object"
    },
    "forbiddenBehavior": {
      "type": "object"
    },
    "filesAllowedToChange": {
      "type": "array"
    },
    "filesForbiddenToChange": {
      "type": "array"
    },
    "validationCommands": {
      "type": "array"
    }
  },
  "additionalProperties": true
}
