{
  "schema": "ardyn.phase-5.27.approval-evaluator-candidate-intake-checkpoint",
  "schemaVersion": "0.1.0",
  "phase": "phase-5.27-approval-evaluator-candidate-intake-checkpoint",
  "artifactKind": "approval-evaluator-candidate-intake-checkpoint",
  "metadataGeneratedAt": "1970-01-01T00:00:00.000Z",
  "sourcePhase": {
    "phase": "phase-5.26-review-artifact-evaluator-input-handoff",
    "reviewArtifactEvaluatorInputHandoffPath": "packages/core/src/index.mjs#createReviewArtifactEvaluatorInputHandoffForReview",
    "candidateIntakeCheckpointPath": "packages/core/src/index.mjs#createApprovalEvaluatorCandidateIntakeCheckpointForReview",
    "sourceEvaluatorInputCandidateFixture": "tests/fixtures/host-policy/phase5-26/review-artifact-evaluator-input-handoff.json",
    "runtimeEnabled": false,
    "approvalGrantProduced": false
  },
  "intakeSummary": {
    "intakeCheckpointRecorded": true,
    "checkpointKind": "approval-evaluator-candidate-intake-checkpoint",
    "checkpointReviewOnly": true,
    "checkpointAuthoritative": false,
    "validEvaluatorInputCandidatesProduceIntakeCheckpointState": true,
    "missingEvaluatorInputCandidatesRejected": true,
    "malformedEvaluatorInputCandidatesRejected": true,
    "emptyEvaluatorInputCandidatesRejected": true,
    "conflictingEvaluatorInputCandidatesRejected": true,
    "staleEvaluatorInputCandidatesRejected": true,
    "revokedEvaluatorInputCandidatesRejected": true,
    "unknownEvaluatorInputCandidatesRejected": true,
    "duplicateInvalidEvaluatorInputCandidatesRejected": true,
    "authorizingLookingEvaluatorInputCandidatesRejected": true,
    "runtimeEffectTrueEvaluatorInputCandidatesRejected": true,
    "processFlagTrueEvaluatorInputCandidatesRejected": true,
    "unsafeEvaluatorInputCandidatesRejected": true,
    "intakeCheckpointStateIsApprovalGrant": false,
    "approvalGrantProduced": false,
    "approvalGrantPersisted": false,
    "runtimePermissionGranted": false,
    "commandExposurePermissionGranted": false,
    "runtimeEnabled": false,
    "runtimeCommandEnabled": false,
    "runtimeCommandExposureEnabled": false,
    "runtimeExecutionEnabled": false,
    "serveRuntimeStillDefaultBlocked": true,
    "dryRunBypassesBlock": false,
    "canEnableRuntime": false
  },
  "intakeInputShape": {
    "evaluatorInputCandidatesRequired": true,
    "evaluatorInputCandidateSchema": "ardyn.phase-5.26.review-artifact-evaluator-input-candidate",
    "evaluatorInputCandidateMode": "review-only",
    "sourceReviewArtifactRequired": true,
    "validEvaluatorInputCandidateRequired": true,
    "authorizingLookingCandidatePolicy": "fail-closed",
    "runtimeEffectTrueCandidatePolicy": "fail-closed",
    "processFlagTrueCandidatePolicy": "fail-closed",
    "unsafeCandidatePolicy": "fail-closed",
    "conflictingInputPolicy": "fail-closed",
    "duplicateInvalidInputPolicy": "fail-closed",
    "filesystemWatcherAllowed": false,
    "externalSourceLookupAllowed": false,
    "secretsEnvIngestionAllowed": false,
    "filePathAllowed": false,
    "urlAllowed": false
  },
  "intakeResultShape": {
    "schema": "ardyn.phase-5.27.approval-evaluator-candidate-intake-checkpoint-result",
    "schemaVersion": "0.1.0",
    "checkpointKind": "approval-evaluator-candidate-intake-checkpoint",
    "checkpointMode": "review-only",
    "reviewOnly": true,
    "authoritative": false,
    "validEvaluatorInputCandidatesMayProduceIntakeCheckpointState": true,
    "intakeCheckpointStateSchema": "ardyn.phase-5.27.approval-evaluator-candidate-intake-state",
    "intakeCheckpointStateIsApprovalGrant": false,
    "approvalGrantProduced": false,
    "approvalGrantPersisted": false,
    "runtimePermissionGranted": false,
    "commandExposurePermissionGranted": false,
    "runtimeCommandExposureEnabled": false,
    "runtimeExecutionEnabled": false,
    "runtimeEffectAllFalse": true
  },
  "intakeCases": [
    {
      "caseId": "missing-approval-evaluator-candidate-intake-input-rejected",
      "classification": "missing_approval_evaluator_candidate_intake_input_rejected",
      "intakeCheckpointStateProduced": false,
      "intakeCheckpointStateIsApprovalGrant": false,
      "reviewOnly": true,
      "authoritative": false,
      "approvalGrant": {
        "produced": false,
        "persisted": false,
        "grantId": null
      },
      "runtimePermissionGranted": false,
      "commandExposurePermissionGranted": false,
      "runtimeCommandExposureEnabled": false,
      "runtimeExecutionEnabled": false,
      "runtimeEffect": {
        "runtimeEnabled": false,
        "runtimeStarted": false,
        "runtimeReady": false,
        "runtimeCommandEnabled": false,
        "runtimeCommandExposureEnabled": false,
        "runtimeExecutionEnabled": false,
        "runtimeExecuted": false,
        "approvalGrantProduced": false,
        "approvalGrantPersisted": false,
        "approvalEvaluatorAuthoritative": false
      }
    },
    {
      "caseId": "malformed-approval-evaluator-candidate-intake-input-rejected",
      "classification": "malformed_approval_evaluator_candidate_intake_input_rejected",
      "intakeCheckpointStateProduced": false,
      "intakeCheckpointStateIsApprovalGrant": false,
      "reviewOnly": true,
      "authoritative": false,
      "approvalGrant": {
        "produced": false,
        "persisted": false,
        "grantId": null
      },
      "runtimePermissionGranted": false,
      "commandExposurePermissionGranted": false,
      "runtimeCommandExposureEnabled": false,
      "runtimeExecutionEnabled": false,
      "runtimeEffect": {
        "runtimeEnabled": false,
        "runtimeStarted": false,
        "runtimeReady": false,
        "runtimeCommandEnabled": false,
        "runtimeCommandExposureEnabled": false,
        "runtimeExecutionEnabled": false,
        "runtimeExecuted": false,
        "approvalGrantProduced": false,
        "approvalGrantPersisted": false,
        "approvalEvaluatorAuthoritative": false
      }
    },
    {
      "caseId": "malformed-approval-evaluator-candidate-invalid-reviewed-at-rejected",
      "classification": "malformed_approval_evaluator_candidate_intake_input_rejected",
      "intakeCheckpointStateProduced": false,
      "intakeCheckpointStateIsApprovalGrant": false,
      "reviewOnly": true,
      "authoritative": false,
      "approvalGrant": {
        "produced": false,
        "persisted": false,
        "grantId": null
      },
      "runtimePermissionGranted": false,
      "commandExposurePermissionGranted": false,
      "runtimeCommandExposureEnabled": false,
      "runtimeExecutionEnabled": false,
      "runtimeEffect": {
        "runtimeEnabled": false,
        "runtimeStarted": false,
        "runtimeReady": false,
        "runtimeCommandEnabled": false,
        "runtimeCommandExposureEnabled": false,
        "runtimeExecutionEnabled": false,
        "runtimeExecuted": false,
        "approvalGrantProduced": false,
        "approvalGrantPersisted": false,
        "approvalEvaluatorAuthoritative": false
      }
    },
    {
      "caseId": "empty-approval-evaluator-candidate-intake-input-rejected",
      "classification": "empty_approval_evaluator_candidate_intake_input_rejected",
      "intakeCheckpointStateProduced": false,
      "intakeCheckpointStateIsApprovalGrant": false,
      "reviewOnly": true,
      "authoritative": false,
      "approvalGrant": {
        "produced": false,
        "persisted": false,
        "grantId": null
      },
      "runtimePermissionGranted": false,
      "commandExposurePermissionGranted": false,
      "runtimeCommandExposureEnabled": false,
      "runtimeExecutionEnabled": false,
      "runtimeEffect": {
        "runtimeEnabled": false,
        "runtimeStarted": false,
        "runtimeReady": false,
        "runtimeCommandEnabled": false,
        "runtimeCommandExposureEnabled": false,
        "runtimeExecutionEnabled": false,
        "runtimeExecuted": false,
        "approvalGrantProduced": false,
        "approvalGrantPersisted": false,
        "approvalEvaluatorAuthoritative": false
      }
    },
    {
      "caseId": "conflicting-approval-evaluator-candidate-intake-input-rejected",
      "classification": "conflicting_approval_evaluator_candidate_intake_input_rejected",
      "intakeCheckpointStateProduced": false,
      "intakeCheckpointStateIsApprovalGrant": false,
      "reviewOnly": true,
      "authoritative": false,
      "approvalGrant": {
        "produced": false,
        "persisted": false,
        "grantId": null
      },
      "runtimePermissionGranted": false,
      "commandExposurePermissionGranted": false,
      "runtimeCommandExposureEnabled": false,
      "runtimeExecutionEnabled": false,
      "runtimeEffect": {
        "runtimeEnabled": false,
        "runtimeStarted": false,
        "runtimeReady": false,
        "runtimeCommandEnabled": false,
        "runtimeCommandExposureEnabled": false,
        "runtimeExecutionEnabled": false,
        "runtimeExecuted": false,
        "approvalGrantProduced": false,
        "approvalGrantPersisted": false,
        "approvalEvaluatorAuthoritative": false
      }
    },
    {
      "caseId": "stale-approval-evaluator-candidate-intake-input-rejected",
      "classification": "stale_approval_evaluator_candidate_intake_input_rejected",
      "intakeCheckpointStateProduced": false,
      "intakeCheckpointStateIsApprovalGrant": false,
      "reviewOnly": true,
      "authoritative": false,
      "approvalGrant": {
        "produced": false,
        "persisted": false,
        "grantId": null
      },
      "runtimePermissionGranted": false,
      "commandExposurePermissionGranted": false,
      "runtimeCommandExposureEnabled": false,
      "runtimeExecutionEnabled": false,
      "runtimeEffect": {
        "runtimeEnabled": false,
        "runtimeStarted": false,
        "runtimeReady": false,
        "runtimeCommandEnabled": false,
        "runtimeCommandExposureEnabled": false,
        "runtimeExecutionEnabled": false,